{
  "protocolVersion": "1.0",
  "receiptId": "0193a62e-7b11-74a8-9c3d-f1e2a3b4c5d6",
  "interval": {
    "start": "2026-07-22T10:00:00Z",
    "end": "2026-07-22T10:00:02Z",
    "coverageMs": 2000
  },
  "subject": {
    "id": "sha256:abcd1234efgh567890ijklmnopqrstuv",
    "type": "embodied"
  },
  "evidence": [
    {
      "engineId": "com.example.simulation",
      "engineVersion": "1.0.0",
      "confidence": 0.85,
      "payload": {
        "score": 0.85
      },
      "payloadDigest": "68b211b6633b2c4393664710c7dc69a928f6363d6a4c9c2c18fced6fe44363b0"
    }
  ],
  "assertions": {
    "observationOccurred": {
      "value": true,
      "confidence": 0.95
    },
    "continuityMaintained": {
      "value": true,
      "confidence": 0.85
    },
    "receiptIntegrity": {
      "value": true,
      "confidence": 1
    }
  },
  "issuer": {
    "id": "6fc751221153e2d8",
    "publicKey": "e2b399c54019a988e1c75d1f53a4823c132175c7a954d466c14bafe17dd87625"
  },
  "previousReceiptHash": null,
  "references": [],
  "expiresAt": "2026-12-31T23:59:59Z",
  "signature": {
    "algorithm": "Ed25519",
    "value": "8214b8eddfbeeda49e5b00a8266236a4ea369680b0ba812b672bdb0a8464daaa93471f1528c330f57c0af284d38ca1a64b430d7c64d715aaaf90d07eba026f0c",
    "signedAt": "2026-07-22T10:00:02Z"
  }
}